{"contractVersion":"1.0.0","validationVersion":"1.0.0","auditId":"97d6b2c7-03b9-4530-8ea7-16557502c638","generatedAt":"2026-08-23T03:13:22.990Z","provider":"playwright-conversion-path","status":"NOT_ASSESSED","pages":[{"url":"https://rebootbusinesscoaching.com","role":"home","status":"NOT_ASSESSED","checks":{"cta":{"found":null,"visible":null,"interactable":null,"target":null,"targetResolves":null,"obstructed":null},"menu":{"found":null,"usable":null},"form":{"found":null,"fieldsEditable":null,"submitEnabled":null},"destination":{"checked":null,"loaded":null}},"limitations":["browser validation not enabled"],"screenshotRef":null},{"url":"https://rebootbusinesscoaching.com/about","role":"service","status":"NOT_ASSESSED","checks":{"cta":{"found":null,"visible":null,"interactable":null,"target":null,"targetResolves":null,"obstructed":null},"menu":{"found":null,"usable":null},"form":{"found":null,"fieldsEditable":null,"submitEnabled":null},"destination":{"checked":null,"loaded":null}},"limitations":["browser validation not enabled"],"screenshotRef":null},{"url":"https://rebootbusinesscoaching.com/services","role":"service","status":"NOT_ASSESSED","checks":{"cta":{"found":null,"visible":null,"interactable":null,"target":null,"targetResolves":null,"obstructed":null},"menu":{"found":null,"usable":null},"form":{"found":null,"fieldsEditable":null,"submitEnabled":null},"destination":{"checked":null,"loaded":null}},"limitations":["browser validation not enabled"],"screenshotRef":null},{"url":"https://rebootbusinesscoaching.com/home","role":"about","status":"NOT_ASSESSED","checks":{"cta":{"found":null,"visible":null,"interactable":null,"target":null,"targetResolves":null,"obstructed":null},"menu":{"found":null,"usable":null},"form":{"found":null,"fieldsEditable":null,"submitEnabled":null},"destination":{"checked":null,"loaded":null}},"limitations":["browser validation not enabled"],"screenshotRef":null},{"url":"https://rebootbusinesscoaching.com/insights","role":"education","status":"NOT_ASSESSED","checks":{"cta":{"found":null,"visible":null,"interactable":null,"target":null,"targetResolves":null,"obstructed":null},"menu":{"found":null,"usable":null},"form":{"found":null,"fieldsEditable":null,"submitEnabled":null},"destination":{"checked":null,"loaded":null}},"limitations":["browser validation not enabled"],"screenshotRef":null}],"summary":{"requested":5,"pass":0,"partial":0,"failed":0,"notAssessed":5},"limitations":["Browser validation not enabled for this run"]}