{"contractVersion":"1.0.0","validationVersion":"1.0.0","auditId":"9714c206-8ed3-4686-8fe2-ceeca0ca0f82","generatedAt":"2026-08-27T22:32:53.188Z","provider":"playwright-conversion-path","status":"PARTIAL","pages":[{"url":"https://www.tbkcreative.com","role":"home","status":"PARTIAL","checks":{"desktop":{"cta":{"found":true,"visible":true,"interactable":true,"target":"https://www.tbkcreative.com/jointbk/","targetResolves":true,"obstructed":false},"menu":{"found":true,"usable":true},"form":{"found":true,"fieldsEditable":true,"submitEnabled":true,"limitation":null},"destination":{"checked":true,"loaded":true},"responseHeaders":{"collected":true,"xFrameOptions":false,"xContentTypeOptions":false,"referrerPolicy":false,"contentSecurityPolicy":false,"values":{"xFrameOptions":null,"xContentTypeOptions":null,"referrerPolicy":null,"contentSecurityPolicy":null}}},"mobile":{"cta":{"found":true,"visible":false,"interactable":false,"target":"https://www.tbkcreative.com/jointbk/","targetResolves":true,"obstructed":null},"menu":{"found":true,"usable":false},"form":{"found":true,"fieldsEditable":true,"submitEnabled":true,"limitation":null},"destination":{"checked":true,"loaded":true},"responseHeaders":{"collected":true,"xFrameOptions":false,"xContentTypeOptions":false,"referrerPolicy":false,"contentSecurityPolicy":false,"values":{"xFrameOptions":null,"xContentTypeOptions":null,"referrerPolicy":null,"contentSecurityPolicy":null}}}},"limitations":[],"screenshotRef":{"key":"tenants/omnipressence/clients/www.tbkcreative.com-tbkcreative/audits/9714c206-8ed3-4686-8fe2-ceeca0ca0f82/evidence/path-validation-0.png","sha256":"69d754029a6982ce80fc33a5e9443f9c5aa3035ee0e9b070971a0cb6300dfebc","bytes":324464}},{"url":"https://www.tbkcreative.com/book-a-call","role":"conversion","status":"PARTIAL","checks":{"desktop":{"cta":{"found":true,"visible":true,"interactable":true,"target":"https://www.tbkcreative.com/jointbk/","targetResolves":true,"obstructed":false},"menu":{"found":true,"usable":true},"form":{"found":true,"fieldsEditable":true,"submitEnabled":true,"limitation":null},"destination":{"checked":true,"loaded":true},"responseHeaders":{"collected":true,"xFrameOptions":false,"xContentTypeOptions":false,"referrerPolicy":false,"contentSecurityPolicy":false,"values":{"xFrameOptions":null,"xContentTypeOptions":null,"referrerPolicy":null,"contentSecurityPolicy":null}}},"mobile":{"cta":{"found":true,"visible":false,"interactable":false,"target":"https://www.tbkcreative.com/jointbk/","targetResolves":true,"obstructed":null},"menu":{"found":true,"usable":false},"form":{"found":true,"fieldsEditable":true,"submitEnabled":true,"limitation":null},"destination":{"checked":true,"loaded":true},"responseHeaders":{"collected":true,"xFrameOptions":false,"xContentTypeOptions":false,"referrerPolicy":false,"contentSecurityPolicy":false,"values":{"xFrameOptions":null,"xContentTypeOptions":null,"referrerPolicy":null,"contentSecurityPolicy":null}}}},"limitations":[],"screenshotRef":{"key":"tenants/omnipressence/clients/www.tbkcreative.com-tbkcreative/audits/9714c206-8ed3-4686-8fe2-ceeca0ca0f82/evidence/path-validation-1.png","sha256":"8fe1269ce445c695a8def099bda1b394392747da585cc42a903d514149d4b197","bytes":88990}},{"url":"https://www.tbkcreative.com/our-work/legate-injury-lawyers","role":"service","status":"PARTIAL","checks":{"desktop":{"cta":{"found":true,"visible":true,"interactable":true,"target":"https://www.tbkcreative.com/jointbk/","targetResolves":true,"obstructed":false},"menu":{"found":true,"usable":true},"form":{"found":true,"fieldsEditable":true,"submitEnabled":true,"limitation":null},"destination":{"checked":true,"loaded":true},"responseHeaders":{"collected":true,"xFrameOptions":false,"xContentTypeOptions":false,"referrerPolicy":false,"contentSecurityPolicy":false,"values":{"xFrameOptions":null,"xContentTypeOptions":null,"referrerPolicy":null,"contentSecurityPolicy":null}}},"mobile":{"cta":{"found":true,"visible":false,"interactable":false,"target":"https://www.tbkcreative.com/jointbk/","targetResolves":true,"obstructed":null},"menu":{"found":true,"usable":false},"form":{"found":true,"fieldsEditable":true,"submitEnabled":true,"limitation":null},"destination":{"checked":true,"loaded":true},"responseHeaders":{"collected":true,"xFrameOptions":false,"xContentTypeOptions":false,"referrerPolicy":false,"contentSecurityPolicy":false,"values":{"xFrameOptions":null,"xContentTypeOptions":null,"referrerPolicy":null,"contentSecurityPolicy":null}}}},"limitations":[],"screenshotRef":{"key":"tenants/omnipressence/clients/www.tbkcreative.com-tbkcreative/audits/9714c206-8ed3-4686-8fe2-ceeca0ca0f82/evidence/path-validation-2.png","sha256":"f15cdc1ef0345757bf95cbda584b93b22bb7af2ca12e28be6a69ddc4ac3aea4b","bytes":655921}},{"url":"https://www.tbkcreative.com/services/capture","role":"service","status":"PARTIAL","checks":{"desktop":{"cta":{"found":true,"visible":true,"interactable":true,"target":"https://www.tbkcreative.com/jointbk/","targetResolves":true,"obstructed":false},"menu":{"found":true,"usable":true},"form":{"found":true,"fieldsEditable":true,"submitEnabled":true,"limitation":null},"destination":{"checked":true,"loaded":true},"responseHeaders":{"collected":true,"xFrameOptions":false,"xContentTypeOptions":false,"referrerPolicy":false,"contentSecurityPolicy":false,"values":{"xFrameOptions":null,"xContentTypeOptions":null,"referrerPolicy":null,"contentSecurityPolicy":null}}},"mobile":{"cta":{"found":true,"visible":false,"interactable":false,"target":"https://www.tbkcreative.com/jointbk/","targetResolves":true,"obstructed":null},"menu":{"found":true,"usable":false},"form":{"found":true,"fieldsEditable":true,"submitEnabled":true,"limitation":null},"destination":{"checked":true,"loaded":true},"responseHeaders":{"collected":true,"xFrameOptions":false,"xContentTypeOptions":false,"referrerPolicy":false,"contentSecurityPolicy":false,"values":{"xFrameOptions":null,"xContentTypeOptions":null,"referrerPolicy":null,"contentSecurityPolicy":null}}}},"limitations":[],"screenshotRef":{"key":"tenants/omnipressence/clients/www.tbkcreative.com-tbkcreative/audits/9714c206-8ed3-4686-8fe2-ceeca0ca0f82/evidence/path-validation-3.png","sha256":"cdcd0c12e288eab66a0bd98b77b60d49ed1456f2ce92078821ebc3aab1e8a95e","bytes":44248}},{"url":"https://www.tbkcreative.com/about","role":"about","status":"PARTIAL","checks":{"desktop":{"cta":{"found":true,"visible":true,"interactable":true,"target":"https://www.tbkcreative.com/jointbk/","targetResolves":true,"obstructed":false},"menu":{"found":true,"usable":true},"form":{"found":true,"fieldsEditable":true,"submitEnabled":true,"limitation":null},"destination":{"checked":true,"loaded":true},"responseHeaders":{"collected":true,"xFrameOptions":false,"xContentTypeOptions":false,"referrerPolicy":false,"contentSecurityPolicy":false,"values":{"xFrameOptions":null,"xContentTypeOptions":null,"referrerPolicy":null,"contentSecurityPolicy":null}}},"mobile":{"cta":{"found":true,"visible":false,"interactable":false,"target":"https://www.tbkcreative.com/jointbk/","targetResolves":true,"obstructed":null},"menu":{"found":true,"usable":false},"form":{"found":true,"fieldsEditable":true,"submitEnabled":true,"limitation":null},"destination":{"checked":true,"loaded":true},"responseHeaders":{"collected":true,"xFrameOptions":false,"xContentTypeOptions":false,"referrerPolicy":false,"contentSecurityPolicy":false,"values":{"xFrameOptions":null,"xContentTypeOptions":null,"referrerPolicy":null,"contentSecurityPolicy":null}}}},"limitations":[],"screenshotRef":{"key":"tenants/omnipressence/clients/www.tbkcreative.com-tbkcreative/audits/9714c206-8ed3-4686-8fe2-ceeca0ca0f82/evidence/path-validation-4.png","sha256":"acfba73f50d9d447031cea7519576b0467056ce74c19f2c1dca5d0033777f8da","bytes":1037693}},{"url":"https://www.tbkcreative.com/our-work/lets-make-results-lmr-lottery-consulting-inc","role":"proof","status":"PARTIAL","checks":{"desktop":{"cta":{"found":true,"visible":true,"interactable":true,"target":"https://www.tbkcreative.com/jointbk/","targetResolves":true,"obstructed":false},"menu":{"found":true,"usable":true},"form":{"found":true,"fieldsEditable":true,"submitEnabled":true,"limitation":null},"destination":{"checked":true,"loaded":true},"responseHeaders":{"collected":true,"xFrameOptions":false,"xContentTypeOptions":false,"referrerPolicy":false,"contentSecurityPolicy":false,"values":{"xFrameOptions":null,"xContentTypeOptions":null,"referrerPolicy":null,"contentSecurityPolicy":null}}},"mobile":{"cta":{"found":true,"visible":false,"interactable":false,"target":"https://www.tbkcreative.com/jointbk/","targetResolves":true,"obstructed":null},"menu":{"found":true,"usable":false},"form":{"found":true,"fieldsEditable":true,"submitEnabled":true,"limitation":null},"destination":{"checked":true,"loaded":true},"responseHeaders":{"collected":true,"xFrameOptions":false,"xContentTypeOptions":false,"referrerPolicy":false,"contentSecurityPolicy":false,"values":{"xFrameOptions":null,"xContentTypeOptions":null,"referrerPolicy":null,"contentSecurityPolicy":null}}}},"limitations":[],"screenshotRef":{"key":"tenants/omnipressence/clients/www.tbkcreative.com-tbkcreative/audits/9714c206-8ed3-4686-8fe2-ceeca0ca0f82/evidence/path-validation-5.png","sha256":"143a7ecb2fe62d9be630c923e0d5d2a0dfa1761013e095e884e684a35ad88655","bytes":348365}}],"summary":{"requested":6,"pass":0,"partial":6,"failed":0,"notAssessed":0},"limitations":[]}